{
  "taskId": "agt-0000000000000a02",
  "schemaVersion": "v3-agent-step-plan/0.1",
  "goal": "Clean quarterly sales data and prepare a reviewed Calc patch.",
  "createdAt": "2026-06-10T10:21:00Z",
  "ownerSurface": "calc",
  "maxSteps": 5,
  "approvalMode": "whole-task",
  "approvalPolicy": {
    "policyDoc": "docs/product/v3/w6-approval-policy.md",
    "defaultMode": "whole-task",
    "selectedModeSource": "default-whole-task",
    "perStepRequiresExplicitUserChoice": true,
    "implicitPerStepPromptsAllowed": false,
    "promptStrategy": "final-review-only",
    "reviewStepRequired": true,
    "approvalEvidence": "user-approval",
    "runtimeApprovalUiImplementation": "not-started"
  },
  "resumePolicy": {
    "policyDoc": "docs/product/v3/w6-resume-policy.md",
    "crossSessionResumeAllowed": true,
    "resumePoint": "evidence-complete-checkpoint",
    "requiresUserConfirmation": true,
    "requiresDocumentHashMatch": true,
    "requiresShadowSnapshot": true,
    "requiresAuditReplay": true,
    "autoResumeAllowed": false,
    "staleCheckpointBehavior": "fail-closed-user-visible",
    "checkpointEvidence": "required",
    "runtimeResumeImplementation": "not-started"
  },
  "dataBoundary": {
    "defaultServiceMode": "offline",
    "allowPublicEgress": false,
    "requiresPolicyPreflight": true
  },
  "sandbox": {
    "mode": "shadow-doc",
    "mergeTarget": "main-doc",
    "failureIsolation": "discard-step-branch"
  },
  "shadowDocPolicy": {
    "policyDoc": "docs/product/v3/w6-shadow-doc-policy.md",
    "shadowDocMode": "per-step-compatible-branch",
    "writerCompatibilityTarget": "v2-w3-swdocshell",
    "requiresExistingSwDocShellCompatibility": true,
    "createsNewDocShellType": false,
    "mergePath": "v2-apply-plan-runtime",
    "mainDocMutationBeforeApprovalAllowed": false,
    "mergeRequiresApproval": true,
    "runtimeShadowDocImplementation": "not-started"
  },
  "dependencyPolicy": {
    "policyDoc": "docs/product/v3/w6-dependency-policy.md",
    "graphType": "forward-only-dag",
    "executionOrder": "topological-index",
    "allowsFanIn": true,
    "allowsFanOut": true,
    "allowsCycles": false,
    "allowsFutureDependencies": false,
    "allowsParallelRuntime": false,
    "runtimeSchedulerImplementation": "not-started"
  },
  "plannerValidation": {
    "policyDoc": "docs/product/v3/w6-plan-validation-policy.md",
    "validationPhase": "before-execution",
    "onInvalidPlan": "fail-closed-user-visible",
    "blocksExecution": true,
    "autoRetryAllowed": false,
    "autoSimplificationAllowed": false,
    "userRetryAllowed": true,
    "invalidPlanEvidence": "required",
    "runtimePlannerImplementation": "not-started"
  },
  "promptPolicy": {
    "policyDoc": "docs/product/v3/w6-prompt-library.md",
    "promptSetId": "w6-plan-act-observe-v1",
    "promptSetVersion": "v1",
    "plannerPromptId": "planner-v1",
    "actorPromptId": "actor-v1",
    "observerPromptId": "observer-v1",
    "deterministicParameters": {
      "temperature": 0,
      "topP": 1,
      "seedRequired": true
    },
    "publicEgressAllowed": false,
    "runtimePromptExecution": "not-started"
  },
  "tokenLock": {
    "patchStepMustUseApplyPlanRuntime": true,
    "tokenCounts": {
      "ParagraphAction": 7,
      "CellAction": 5,
      "SlideElementAction": 4
    }
  },
  "steps": [
    {
      "index": 0,
      "kind": "query",
      "title": "Inspect columns",
      "description": "Query local workbook context for column types and duplicate markers.",
      "dependencies": [],
      "expectedOutput": {
        "kind": "knowledge-chunks",
        "schemaRef": "knowledge-index-result"
      },
      "evidence": [
        "policy-decision",
        "kb-query"
      ],
      "policy": {
        "preflight": true,
        "auditLog": true
      }
    },
    {
      "index": 1,
      "kind": "transform",
      "title": "Plan cleanup",
      "description": "Build a structured cleanup summary for dates, currency, and duplicate rows.",
      "dependencies": [
        0
      ],
      "expectedOutput": {
        "kind": "analysis-summary",
        "schemaRef": "agent-step-result"
      },
      "evidence": [
        "policy-decision",
        "provider-call"
      ],
      "policy": {
        "preflight": true,
        "auditLog": true
      }
    },
    {
      "index": 2,
      "kind": "patch",
      "title": "Patch cells",
      "description": "Create the Calc cell patch through the V2 ApplyPlan runtime path in a shadow document.",
      "dependencies": [
        1
      ],
      "expectedOutput": {
        "kind": "apply-plan-runtime",
        "schemaRef": "apply-plan-runtime"
      },
      "evidence": [
        "policy-decision",
        "provider-call",
        "shadow-doc-diff",
        "apply-plan-runtime-validated"
      ],
      "policy": {
        "preflight": true,
        "auditLog": true
      }
    },
    {
      "index": 3,
      "kind": "review",
      "title": "Review diff",
      "description": "Present the cell diff for user approval before merging changes.",
      "dependencies": [
        2
      ],
      "expectedOutput": {
        "kind": "approval-decision",
        "schemaRef": "user-approval"
      },
      "evidence": [
        "policy-decision",
        "user-approval"
      ],
      "policy": {
        "preflight": true,
        "auditLog": true
      }
    },
    {
      "index": 4,
      "kind": "patch",
      "title": "Apply labels",
      "description": "Prepare final header labels and formatting through ApplyPlan runtime after approval.",
      "dependencies": [
        3
      ],
      "expectedOutput": {
        "kind": "apply-plan-runtime",
        "schemaRef": "apply-plan-runtime"
      },
      "evidence": [
        "policy-decision",
        "provider-call",
        "shadow-doc-diff",
        "apply-plan-runtime-validated"
      ],
      "policy": {
        "preflight": true,
        "auditLog": true
      }
    }
  ],
  "evidence": {
    "requiredForEveryStep": [
      "policy-decision",
      "evidence-record"
    ],
    "auditLogRequired": true,
    "blocksMergeOnMissingEvidence": true
  }
}
